text,label
5 things men can do to strengthen their relationship,0
how an obama cut-out is helping me survive a trump presidency,0
queen elizabeth annoyed nude pictures of prince harry don't show anything good,1
5 late-night hosts made the same dumb joke about trump's nondisclosure agreement,0
neighborhood starting to get too safe for family to afford,1
"news roundup for august 17, 2017",0
word search on box of frosted mini-wheats fucking impossible,1
man updates little monologue recited when extended relatives ask how he's doing,1
sarah huckabee sanders flatly rejects jim acosta's assertion that he's jim acosta,1
humiliated man discovers embroidery on his jean pockets,1
gun lobbyist warns gun owners could resort to 'bullet box' if they don't like election results,0
melania trump responds to charlottesville clashes before president does,0
"older brother playing with younger brother on swing set will one day con him out of $50,000",1
biden requests to be named special envoy to reno,1
nation's financial advisors recommend capturing magical creature that grants wishes,1
dishwasher broke,1
cinemax director wins award for skinematography,1
report: friend's apartment not nice enough to be asking people to take off shoes,1
finding comfort in the wake of 9/11,0
"as sanctuary state, california takes deportation fight to new level",0
"the feds are going to collect better data on police killings, but we probably won't see it",0
local dad gets this show on the road,1
snowy mountain in pyeongchang figures it can withstand 1 or 2 more big cheers before triggering avalanche,1
a murder in kurdistan,0
"corporate, koch money dominates early 2016 senate race spending",0
role of tree ineptly played by second-grader,1
woman comforting friend just going to throw compliments against wall and see what sticks,1
report: nearby conversation definitely just got quiet to prevent you from hearing it,1
the moment casey gerald realized the importance of doubt,0
cdc issues warning of full-blown epidemic of the blahs,1
florida county asks judge to clarify gay marriage ruling,0
poor kwanzaa sales disappoint retailers,1
conan o'brien reveals how donald trump coped when twitter went down,0
trump: 'i am a very stupid human being',1
spooked rubio staffers drive slowly past abandoned jeb bush campaign headquarters,1
mara wilson on dealing with mental illness in the public eye,0
"fourth-grader's world war ii project vastly oversimplifies importance of air combat, uncle reports",1
trump tells guam governor nuclear tensions will mean more tourism,0
how can you tell if a dog rescue group is legit?,0
weird al's 'lame claim to fame' mocks celebrity obsession,0
the media: are they media-obsessed?,1
10 habits of people in the most toxic relationships,0
obama's embarrassing ska album resurfaces,1
bin laden returns to sea,1
visit home reveals parents currently watching previously undiscovered game show,1
open floor plan increases office shooter's productivity by 95%,1
report: crooked border guards planting illegal immigrants in cars,1
man spends whole day dreading fun activity he signed up for,1
"this labor day, let's boost opportunity in every zip code",0
scientists discover sun is made of hot,1
public school closures are an attack on arkansans of color,0
unemployed sibling makes last push for group mother's day gift,1
islamic fundamentalists condemn casual day,1
new poultry stripe gum hardly tastes like goose after chewing for one minute,1
report: 5th floor a bunch of pompous dicks,1
thai dish apparently costs 3 peppers,1
5 states to decide whether to legalize marijuana or continue honoring god,1
trump budget a disaster for women and families,0
what to know regarding current treatments for ebola,0
trump announces 40-month-long search to fill fbi director post,1
clinton staff readies emp launch to disable all nation's electronic devices,1
"women in business q&a: star jones, president, professional diversity network",0
south korean president shakes hands with north korean leaders during winter olympics opening ceremony,0
impoverished child in third world dreams about one day leaving light on for no reason,1
"emporia, kansas named best small town in america to escape from",1
new year's eve prank leaves 4-year-old glued to mcdonald's toilet,0
congress passes natural disaster digital-enhancement funding,1
rookie told to ease up on crime-scene tape,1
sessions rattles baton along prison bars in speech vowing to crack down on violent crime,1
dept. of transportation to replace highway mile markers with dead raccoons,1
surge soda is back! (and has already sold out once),0
"hillary clinton, bernie sanders gloss over context, disagree on details in democratic debate",0
you wanted government run like a business? you got it.,0
peripheral acquaintance casually mentions she was molested,1
investigation of what fell off nightstand postponed until morning,1
police make arrest in socal lemonade stand heist,0
the world war ii-era women who broke up the disney boys' club,0
secret service shuts down biden's unofficial white house tour operation,1
boehner does damage control: benghazi probe was 'never' about clinton,0
royal baby born,1
"disgruntled bolton shoots 17 un delegates, self",1
movie fails to deliver stupidity promised in preview,1
author of botched daniel holtzclaw profile apologizes for 'lopsided account',0
why lin-manuel miranda will always be a fearless ally of planned parenthood,0
justice breyer unable to look at anything without deliberating constitutionality of it,1
watch: minor league brawl spills into seats,0
how would you redefine study abroad?,0
clinton campaign airlifts 200 crates of volunteers to wisconsin headquarters,1
i cannot do this alone: why allies matter to the down syndrome community,0
"michelle, ross and carson on the wild ride to 'rupaul's drag race'",0
"this artist is tackling 'toxic, fragile' masculinity in a colorful way",0
jojo is back with a perfect 'tringle' of songs,0
video shows security guard choking black teen accused of shoplifting in new york,0
nicolas cage helps raise awareness about missing ohio teen,0
are introverts or extroverts happier?,0
'it's the heart of mississippi': meet the people of oxford,0
8-year-old boy surprises marine dad during firefight in afghanistan,1
"after ireland, the pressure is on italy to legalize same-sex unions",0
the trump team keeps piling on criticism of mitt romney,0
"'no way to prevent this,' says only nation where this regularly happens",1
"russia likely responsible for poisoning spy, uk officials say",0
kourtney kardashian opens up about scott disick's rehab stay,0
rnc leader to trump: tone it down!,0
a family dog's letter to his boy,0
a new massachusetts 'sustainable energy' coalition is really a front for gas interests,0
why you should use conditioner before getting in the shower,0
friday talking points -- it's raining shoes!,0
how a nyc gay couple came to forgive the man who attacked them,0
elderly man spends quiet afternoon in national park feeding trout to eagles,1
judge failed to disclose donation from gop defendant in gerrymandering suit,0
new secret service agent disappointed there are no decoy presidents,1
to the ladies who 'didn't need' the women's march,0
"trump filing shows he paid cohen, after cohen paid stormy",0
a farm boy meets his prince in a beautiful new children's book,0
"beyonce shares more blue ivy photos, melts more hearts",0
reports: pixar executive takes leave of absence after sexual harassment complaints,0
23-hour suicide watch a failure,1
senate still at odds over zika funding with only 3 days left before summer break,0
parents trying to gauge if son complete idiot before deciding whether to move to better school district,1
"jedi chipmunks fight with lightsabers, universe wins",0
area eyesore also a data technician,1
how to botch a wedding toast in 5 words,0
bill cosby feeling better now,1
7 things you should know if you love someone who gets migraines,0
list of politically achievable reforms down to just three minor changes to traffic code,1
congress finally passes bipartisan legislation to address opioid epidemic,0
see the most intense 'secret in their eyes' trailer yet,0
trump once bombarded scottish leader with 16 letters slamming a wind farm,0
supreme court weighs if friendly tips worth millions constitute insider trading,0
michelle obama quietly reassigned to department of agriculture after butting heads with president,1
how boehner can 'clean house':  one sentence to prevent government shutdowns forever,0
pope: it would be 'catastrophic' if 'special interests' derailed climate talks,0
area panties in a bunch,1
news photographer found slain in mexico city,0
restaurant reacts perfectly to diners who were rude to employee with autism,0
alzheimer's and making peace with god,0
nate silver ages 40 years after accidentally using polling projection model on self,1
complete idiot forgot to shave area between mouth and nose,1
travel channel blows its 'bed and breakfasts of new england' wad,1
5 things everyone gets wrong about napping,0
protest again delays hawaii giant telescope construction,0
how the data world missed the boat on trump,0
report: more american children raised by carjackers who didn't realize there was someone in backseat,1
nasa to send earth into space,1
housefly drops everything to go stand on watermelon slice,1
there is no plan b either in yemen or in syria,0
everyone is in love with shawn mendes after iheartradio music awards performance,0
blaming black voter turnout in virginia,0
mitt romney frantically running around ohio smiling and waving,1
ladykiller gets life sentence,1
living life with heart: an interview with tony ducharme,0
cia director quietly buys nuclear-attack insurance,1
maryland teen allegedly sexually abused child since she was 3,0
mortgage market collapse threatens nation's banner ad industry,1
'saturday night live' can't use language as bad as trump's,0
claire danes fantasized about,1
the democrats sang a decades-old hymn of protest during their sit-in,0
magic-markered initials fail to deter breakroom rice-cake thief,1
gop senator concedes democrats had a better process when passing health care law,0
passengers terrified when engine cover rips off plane bound for hawaii,0
"how smartphones damage our skin, according to dermatologists",0
4 out of 5 texas dentists advocate the death penalty,1
the questions we should be asking ourselves when we make school lunch,0
sex tied to better brain power in older age,0
the bonus marchers anniversary and veterans in america,0
james holmes shows up to court wearing glasses with eyeballs dangling out on springs,1
area nephew a very funny young man,1
world's most advanced yo-yo doesn't need you,1
marvel won't make a female thor movie 'any time soon',0
"yes, donald trump is actually going on 'saturday night live' tonight",0
"almost half of world heritage sites are threatened, report finds",0
top congressional watchdog uninterested in trump's conflicts of interest before he takes office,0
anderson cooper decides to keep recent gay conversion therapy private,1
nabisco tentatively adds hummus to list of approved ritz toppings,1
"trump says there's been no russia contact -- of course, much of what he says is untrue",0
protesters ignored,1
street-smart teen dies in library,1
weak-willed coward changes opinion after learning he was wrong,1
religious freedom in practicing the platinum rule,0
senator: russian trolls stoked nfl debate,0
"area man has asshole, old navy written all over him",1
'trump' chant used to intimidate latino high school athletes,0
joy sucked out of room by pumped-up manager,1
man feeling pressure to live up to conversation between barber and customer in next chair,1
greek populace woken up at 6 a.m. by angela merkel's voice booming through loudspeakers across country,1
neighbors remember serial killer as serial killer,1
cop confident he'll be exonerated by clear video evidence of him shooting defenseless black man,1
grab them by the… hand: donald trump's disturbing nonverbal behavior,0
notorious b.i.g. cremation enters fifth week,1
'be aware' is the anthem for self-serving millenial activism,0
netanyahu's legacy: a fractured israel and a divided america,0
"20 years after big tobacco, is it time for 'big pain'?",0
channing tatum's pet goat has died,0
larry wilmore takes down bill cosby on 'the nightly show',0
there have been more mass shootings this year than there have been days,0
mike pence brings wife up onstage to help demonstrate how much contact appropriate before marriage,1
latest bin laden tape for completists only,1
7 ridiculously easy ways to protect your bones at any age,0
surinamese man struggling to write the great surinamese novel,1
supreme leader khamenei says iranian nuclear weapons are a u.s. 'myth',0
need for more places to sit becomes election's most important issue,1
hillary clinton's asian american outreach director leaving campaign,0
nia long: film and tv should look like the world we live in,0
american torturing jobs increasingly outsourced,1
fisher-price designer would like to see 2-year-old try and choke on newest version,1
san francisco begins providing attorneys for immigrants who can't afford them,0
college still looking for absolute saddest place on campus to hold transfer student orientation,1
area man's bathroom a monument to ongoing war against his own disgusting body,1
"tai chi, part 1 (video)",0
america ferrera is basically selena quintanilla's twin in this pic,0
berserk hairdresser cuts bangs without permission,1
poll finds majority of  americans would like things to go right for once,1
cuban migrants adrift at sea drank own blood and urine to stay alive,0
"'captain actual america' overweight, hopelessly in debt",1
there is nothing libertarian about conservatives,0
area senior up for some boggle,1
vietnamese singer wins international transgender beauty pageant,0
man confused by compliment from person whose career he can't help,1
school friends don't find camp songs funny,1
man nostalgic for simpler era of 20 hours ago,1
the perfect to keep a sexy bod and still enjoy your vacation,0
former trump advisor carter page found dumb in d.c. hotel room,1
bacon just one of sprint's new downloadable ring scents,1
area man reduced to this,1
new liver complains of difficulty working with lou reed,1
new evidence reveals christ lounged in tomb for extra hour before finally rising from grave,1
photos show the calais 'jungle' going up in flames,0
nation's sexual degenerates impatient for gay marriage slippery slope to kick in,1
pope francis has a very clear message for 'christians' who build walls,0
huffpost rise: what you need to know on april 20,0
résumé accidentally kept on file,1
watch: 'party monster' michael alig give his first video interview since his release from prison,0
10th-grade class watches ben-hur for two weeks,1
study reveals lobsters feel pain and get off on it like the kinky little perverts they are,1
90% of audience at college graduation involved in heated family argument,1
new aetna wedding registry lets guests purchase medical procedures couple picked out,1
"for city parks, 2014 was the year that was (great)!",0
reporter leads rescuers to truck driver trapped in 10 feet of water,0
the daily fantasy sports protests in nyc looked hilarious,0
an open letter to my shelter dog's first owner,0
here's why some black women aren't here for #womenboycotttwitter,0
"woman asked about drunk driving responds, 'gobble gobble turkey': cops",0
stephen hawking warns about dangers of ai as motorized wheelchair drives toward lake,1
what i understood about a father-daughter relationship only after my father passed away,0
activists criticize prosecutor in charge of tamir rice reports,0
"democratic senator caught on video with $70,000 in drug money",0
'that's so raven' cast reunites on 'the view' and shares show secrets,0
bruce springsteen takes powerful stance amid trump's immigration ban,0
"computer analyst unable to fashion crude tools, grind wheat",1
natalie allen's gps guide for expressing gratitude before bed,0
local man a paper-towel black hole,1
investors stake out greenspan's house for signs of rate increase,1
andy cohen and taylor swift are over their katy perry drama,0
hillary clinton holds infant grandson upside down by ankle in front of convention crowd,1
firenze fireworks: easter explosions in florence,0
jerry falwell: is that guy a dick or what?,1
mayor daley's son appointed head of illinois nepotist party,1
'goodell must go' banners flying over nfl stadiums,0
researchers discover female frogs prefer mate who knows way around the cloaca,1
lauren conrad shares 4 simple rules for dealing with pregnant women,0
ozone repletion project nearly finished,1
the fed and the markets,0
donald trump says our schools are 'flush with cash.' they're falling apart!,0
artist merges genders with her late lover as ultimate artistic collaboration (nsfw),0
ben carson bizarrely attacks cnn host in hostile interview,0
spy satellites show the himalayas' changing glaciers,0
how elizabeth warren's own book makes the case she should run for president,0
the enigmatic art of josef koudelka,0
vilsack reprimanded for spending work hours writing corn blog,1
juan gabriel wins first ever latin grammys three months after death,0
fox news viewers really don't like lifelong republican robert mueller,0
you don't have to 'cherish every moment' to appreciate your children,0
"'i'll make those bastards pay,' teary-eyed mueller whispers into locket containing photo of james comey",1
climate change may melt the glaciers from glacier national park,0
new financial report finds economy invincible forever this time,1
president trump's judicial nominees drive samantha bee to drink,0
director scott schwartz takes on disney's hunchback,0
exxonmobil vows lenient treatment for any species that surrenders voluntarily,1
"techview: linus torvalds, inventor of linux",0
nypd: muslim woman set on fire just before 9/11 anniversary,0
nasa launches first cordless satellite,1
nyt: bloomberg planning independent presidential run,0
beauty industry exec keeps photo of crying 15-year-old girl on desk to remind himself why he does this,1
gop party chairman really doesn't want to talk about abolishing the irs,0
coworker's girlfriend not as pretty as expected,1
man at salad bar has to say every item aloud as he adds it to salad,1
22-year-old fuck complains of age discrimination,1
gay rights leader lookin' good,1
"this great song, bar sources report",1
study finds girls go through manga phase earlier than boys,1
fans erupt over fate of elias koteas' olinsky on 'chicago p.d.',0
how to avoid ending up in a tree in the amazon,0
nfl referee ed hochuli denies cam newton's ageism allegations,0
thursday cry moved up to wednesday due to scheduling conflict,1
report: today the day woman either quits job or goes home and watches 4 hours of netflix,1
this is what happens to your skin during a chemical peel,0
drunk man staring at ihop syrups,1
"parents spend first 4 years of child's life fluctuating wildly between hoping child stays asleep, hoping child wakes up",1
scott bakula jumps into mccain's body just before election,1
3 must-have shoes for the office,0
29-year-old has been going to different friend's wedding every weekend for past 3 years,1
modcloth goes one step further,0
3 toddlers dredged from chuck e. cheese ball pit,1
first-grader reeks of urine,1
desperate wheel of fortune receives approval to use swear words,1
jimmy kimmel asks people if hillary clinton should be impeached,0
report: jack black's life more valuable than yours if it ever comes down to it,1
"surprise, surprise: christopher nolan is not a fan of netflix",0
forget driverless cars. flying vehicles are almost here,0
man given 3 months to live throws in one or two non-sexual things to do,1
nelson mandela celebrates 94th birthday in prison after violating parole,1
unidentified yowling animal in carrier apparently named kiwi,1
"sylvester stallone shells out $400,000 for a statue of himself",0
pre-roe abortion providers on breaking the law to save women's lives,0
top obama official: this is no iraq war,0
in defense of matt harvey,0
photographer diego saldiva lived a nightmare every parent fears,0
researchers find that spanking your children is incredibly fun,1
the bottom line: china miéville's 'this census-taker',0
conversations pretty limited when friend not in midst of crisis,1
god recalls collaborating on joint vision of humanity with deceased creative partner,1
global surveys show strong support for hillary clinton,0
dianne feinstein horrified after new gun control bill disintegrates immediately upon crossing into senate chamber,1
"the soft corruption of clinton, inc. -- and how it could cost democrats the presidency",0
millions of holiday travelers return from parents' homes all caught up on 'the mentalist',1
cuba and the united states: the long view,0
mom figures it about time to sit down adolescent daughter and explain how weight watchers points work,1
bangladesh bloggers fear deadly backlash won't end soon,0
"man pours all his culinary talents into inserting, removing pizza from oven",1
monopoly player insists on being wheelbarrow,1
this is what boy scouts' intolerance to transgender people is doing,0
trevor noah gets a big 'ken boner',0
ferguson decision reaffirms right of police to use deadly force when they feel sufficiently inclined,1
"dogs, humans, and the oxytocin-mediated strong social bond",0
rockin' party dude strongly recommends additional drinking,1
"airline passenger arrested after allegedly saying, 'i kill white people like you'",0
trash bag taped over broken southwest plane window,1
"neglect of wife, children results in promotion",1
the real march madness: slashing student aid,0
supreme court hears arguments in major privacy rights case,0
'wild boar curling' rescues stranded wild boars from frozen lake,0
cnn holds panel discussion to determine if there race problem in america,1
mitch mcconnell says republicans have the votes to pass tax bill,0
facebook reportedly working on healthcare features and apps,0
wealthiest americans ominously remind nation they could easily drop another $10 billion on election,1
youtube reaches 1 trillion racist comments,1
connecticut considers a soda tax,0
scientists claim solar energy will be capable of powering 95% of scorchlands outposts by 2085,1
the secret behind a one day project going viral,0
upper-middle-class woman worries there's better coffee she doesn't know about,1
is there such a thing as 'too much' coffee?,0
faith healer loses patient during routine miracle,1
rival dojo in for big surprise at regionals,1
a rhubarb explainer for everyone who's still confused,0
spaced-out flower child groovin' on a doobie wave,1
"for lgbt people, a routine doctor visit can be a 'degrading experience'",0
'the adventures of young hillary' is what america needs right now,0
richard branson's global-warming donation nearly as much as cost of failed balloon trips,1
new employee still eager enough to pick up slack for coworkers,1
let this cute cat in funny wigs remind you the world isn't all bad,0
washington post: maine gov. paul lepage is 'completely unhinged' and should quit,0
these 10 meals reveal one thing fast food restaurants still get wrong,0
23andme forensic kit informs customer what crimes he's committed,1
white castle crave case handcuffed to wrist,1
how obama moved the cuba needle,0
advertising firm unveils new mute-resistant commercials,1
the public health threat of private anger,0
why russell simmons wants trump to win the gop nomination,0
u.s.-trained syria rebels hand over equipment to al qaeda affiliate,0
hillary clinton on las vegas shooting: 'we must stand up to the nra',0
"how trump really feels about queer people, explained in one sentence",0
"parents are turning to marijuana more than teens, study suggests",0
"chicago announces new tax breaks to attract major new york, la shootings",1
concert security drastically overestimating fans' desire to get close to cheap trick,1
weekend encounter with coworker never acknowledged,1
newspaper formally apologizes to wookiees for a 40-year-old 'star wars' mistake,0
mitt romney jots down ideas for concession speech while obama talks,1
airbnb host decides handwritten note necessary to protect cocktail sauce in fridge,1
18 hilarious bridesmaid proposal cards you can find on etsy,0
"audubon society reveal they've only seen, like, 3 birds",1
asshole from plane greeted at baggage claim by whole family,1
woody harrelson spends two hours drawing marijuana leaf on binder,1
amazon fires warehouse worker who took unauthorized breath,1
man pretty sure he slept,1
mom gathers rolls of wrapping paper around her to stroke softly,1
watch top chef michael voltaggio read one-star yelp reviews,0
fiercest fighting in days between kurds and isis in kobani,0
rest of kickline out sick,1
breaking: aclu hard as a fucking rock right now,1
ko'd martial artist is epitome of show-must-go-on in 'got talent',0
restaurant fires pizza-delivery dog,1
'that nail polish looks horrible on you' and other words of style advice from my grandmother,0
everything you need to know about how stress affects your skin,0
eric holder announces least controversial decision of tenure,1
blue whale found dead on northern california beach likely struck by ship,0
spring cleaning life hacks,0
nation admits it always a little bored by whole jimmy hoffa thing,1
a pivotal law for nyc pets,0
queen elizabeth ii's christmas message: 'light shines in the darkness',0
dog chastised for acting like dog,1
dru hill calls for 'change' in hometown of baltimore,0
"cuba, the us and obama's state of the union",0
trump's controversial pick for doj civil rights chief appears headed for confirmation,0
american muslims and philanthropy,0
"rihanna doesn't care about dark circles, and neither should you",0
area teen accidentally enters teen center,1
free school lunches kept me from starving,0
