text,label
mariah carey reveals her bipolar ii diagnosis in candid interview,0
"sole remaining lung filled with rich, satisfying flavor",1
celebrating my independence from drug addiction,0
jellyfish can't wait to fuck up honeymoon,1
"little girl attempts to play with game boy, flabbergasted by lack of touchscreen",0
area father takes one more look at liner notes of daughter's britney spears album,1
god urges rick perry not to run for president,1
one more (feminist) wonder about 'wonder woman': it passes the abuse litmus test,0
jpso arrests girlfriend of man slain by jefferson deputies in new orleans,0
iraq's prime minister unveils plan to trim criticized government,0
gay man unaware he focus of thousands of prayers,1
god names rightful owner of west bank,1
we need more college graduates,0
mark zuckerberg continues to insist facebook could not possibly have influenced election,0
nutritionists recommend increasing intake of whatever will earn you free t-shirt from restaurant,1
in the new york film fest the outsize egos of artists rule,0
"'vacation jason' of 'the chris gethard show' drops new single, banana peels at aol",0
jonathan adler's stunning new hotel project has a powerful mission,0
the nixonization of donald trump,0
clairvoyant vince vaughn accepts movie role before it's offered,1
cops accused of racism after detaining black man over 'vegetation',0
google still a long way from meeting diversity goals,0
these 8 asian american movement stories from the past year show us the way forward,0
someone filming b-roll at pike place market right now,1
disney begins uploading obama's consciousness to hall of presidents robot,1
drunk pilot going to pull over onto cloud until he sobers up a little,1
man takes parents on tour of city where he came to escape them,1
dear president trump: our grandparents were refugees. this is their story.,0
baltimore police begin slow process of reform in year after freddie gray's death,0
romney campaign releases new picture of candidate standing in situation room during bin laden raid,1
'cool jobs' for baby boomers who want to work in retirement,0
one hint about how to form a new habit (don't overthink it),0
tank operator wishes buddies back home could see him now,1
trump's already urging policy changes after nyc terrorist attack -- without waiting for 'the facts',0
coworkers brought to place of unthinkable intimacy by team-building exercise,1
direct marketer offended by term 'junk mail',1
an exile artist from iraq paints herself into ancient illustrated manuscripts,0
supreme court debuts new spaghetti strap sun-robes for spring,1
owner by far creepiest man in bar,1
8 things we wish our mothers had told us about aging,0
first-time voter will always remember day he cast ballot for nick barborak,1
loss of virginity more humiliating than original virginity,1
custody battle sparks couple's first-ever interest in child,1
puerto rico is a man-made disaster,0
shredding the past,0
this is what it feels like to lose to donald trump,0
sheryl sandberg talks about husband's death in personal commencement speech,0
gop congressman who revived obamacare repeal faces rage at rowdy town hall,0
wooden fruit hoping to become real fruit one day,1
trump warns israel new settlements 'may not help'  peace process,0
scarlett johansson immediately rejects heartwarming prom invite from high school student,1
jason isbell is one nashville-based singer unafraid to talk politics,0
budget woes force heaven to reduce eternal life to 500 billion years,1
this influencer is using youtube to speak frankly about student loan debt,0
south korea suspects female assassins poisoned half-brother of north korean leader,0
depression symptom checklist speaking to area man as no poem ever could,1
most germans fear the effects of a trump election victory,0
horrifying society of grotesque mutants discovered living aboveground,1
is the fda sleeping on the job when it comes to sleeping pills?,0
conrad bain steps down as national kitsch-reference laureate,1
joe paterno's name to remain on joe paterno center for covering up sexual abuse,1
vatican unveils new pope signal,1
here's how older generations are ruining the workplace,0
inspirational disabled horse crosses preakness finish line after 11 hours,1
microsoft word now includes squiggly blue line to alert writer when word is too advanced for mainstream audience,1
chuck todd imitates yoda -- and it's actually pretty good,0
paula abdul's back at it,0
north korea releases new paintings of healthy kim jong il,1
today is green monday: the day to finish up your online shopping,0
first family gets pet asp,1
parent mad 6-year-old didn't like peanuts special,1
why these men bucked tradition and wore an engagement ring,0
"as trump kills daca, bannon's breitbart celebrates a major policy win",0
an art colony thrives on skid row,0
open-minded man would be willing to look past jennifer lawrence's flaws,1
cnn panelists warn north korea situation way too complex for them to discuss intelligently,1
'people's couch' hunk gears up for the holidays in a very big way,0
north korea rings in new year with promises of intercontinental missile,0
fan just going to keep open mind about whether new 'star wars' best or worst movie ever,1
benghazi committee chair: staffer fired for classified info breach,0
area man thinks he was fired because of recession,1
pierced tongue fails to make local woman less boring,1
top climate change doubter didn't mention that oil companies were paying him,0
mitch mcconnell pledges to avoid debt ceiling disaster,0
nuestra palabra: latino writers having their say,0
kylie jenner snaps a bikini selfie,0
tip of area man's tongue refuses to relinquish richard crenna's name,1
search for 'kick-ass shelves' continues,1
"aaron eckhart likes to make one frankenstein movie for them, one frankenstein movie for himself",1
starfucker gives stephen baldwin a hand job,1
documentary viewer can't wait to find out which 4 lads from liverpool changed music forever,1
7 ways to breakup like a boss,0
the edge still introducing self as such,1
tv viewer relates to totally unbelievable character that could never exist in reality,1
"infomercial host skeptical at first, then delighted by product",1
powerful 'his and hers' towel lobby stalls gay marriage legislation,1
breeze plays kick-ass riff on wind chimes,1
sen. mike lee says trump is 'fully cooperating' with russia investigation,0
dice rolled on hot dogs in back of freezer,1
friend wondering if you can catch him up on what happened in previous 7 seasons during 'game of thrones' title sequence,1
u.s. bobsled team pays tribute to late gold medalist steven holcomb,0
comedy central to air touching man show reunion,1
chocolate pudding up $2 a barrel,1
congress can't remember last time it got together and legislated like this,1
the best teams in sports... 5 years from now,0
"'he's a stockbroker,' says woman who finds that exciting",1
donald trump says he'll stick with personal twitter account as president,0
"man arrested for stealing more than $50,000 in beards from hank williams, jr.",1
shake it off: what i learned from a negative review,0
man breaks out dating boxers,1
informal tone of cover letter sets job applicant apart from seriously considered candidates,1
"f. scott fitzgerald, a princeton graduate with his diploma at last",0
comey memoir claims trump was obsessed with disproving 'pee tape' allegation,0
chris rock and dave chappelle did a surprise stand-up set together this weekend,0
area woman lovingly lint rolling cardigan as if tending to prized stallion,1
"shopper takes bizarre journey beyond bed, bath",1
amish woman knew she had quilt sale the moment she laid eyes on chicago couple,1
nabisco snack physicists develop highly unstable quadriscuits,1
texas latinos overwhelmingly support abortion rights,0
god admits he way less strict with last few billion children,1
pizza slice only has one pepperoni,1
"turns out, michael phelps was listening to future during 'angry face'",0
americans pool together $945.23 to counteract corporate money's influence in politics,1
"after shooting, orlando chefs provide thousands of free meals",0
shake shack celebrates the return of 'will & grace' in sweet (and boozy) way,0
j.k. rowling's new show is nothing like 'harry potter',0
why the un rejected turkey's bid for a security council seat?,0
"fighting pests with sounds waves, not pesticides",0
"torture report: america conducts a moral reckoning.  next, moral repair?",0
caller enters remote backwaters of 1-800 automated messaging system,1
brad pitt decides to grow out forehead hair,1
ava duvernay on trump's america: 'art will be our weapon',0
bible study group preparing for bible aptitude test,1
thousands want to name a professional soccer team footy mcfooty face,0
idea of doing nothing until next mass shooting quickly gaining traction in congress,1
meet 10 inspiring people over 50 giving back to the world,0
"was it worth it, america?",0
bill maher jokes about what donald trump will really be doing on his asia trip,0
switzerland passes u.n. inspection after erecting fire escape on matterhorn,1
"great, daughter measuring self-worth against some 13-year-old named skyla now",1
"paul ryan smiles, thumbs up way through question about specificity of tax plan",1
fetish only realized after watching wife drown,1
military prosecutor: senate report on cia interrogation program is accurate,0
"cory booker, kamala harris, elizabeth warren assure dreamers they'll never stop fighting for the 2020 nomination",1
up-and-coming local band signs two-cassette deal,1
rachel mcadams doesn't look like this anymore,0
civil rights movement network law is a much-needed tool,0
toys 'r' us sign triggers pavlovian shrieking response in child,1
friday's morning email: inside trump's presser for the ages,0
"prince harry, meghan markle set up bridal registry at london-area target",1
mom-to-be breaks big news to husband with airplane pilot's help,0
trump's lawyers start to couch statements on russia investigation,0
new downloadable content for 'assassin's creed syndicate' factored into monthly living expenses,1
teen reports saturday night live has sucked since chris kattan left,1
"livestock happiest, healthiest attendees of state fair",1
bungling bicycle-riding robbery suspect is foiled by wet weather,0
protesters stage third day of demonstrations in st. louis over acquittal of former cop,0
oscars line up five non-white presenters,0
report: 92% of divorced parents get back together if children ask enough times,1
leslie jones confirms she's 'moved on' from milo yiannopoulos harassment,0
area man growing a little tired of rushing home to hug loved ones,1
new seals & croft cd club offers 600 seals & crofts cds for a penny,1
chicago's shedd aquarium admits panda exhibit a ghastly mistake,1
palin brushing up on foreign policy at epcot,1
mad lit professor puts finishing touches on bloomsday device,1
amazon offering 'more deals than black friday' in epic prime day sale,0
report: music industry made $18 in 2009,1
"science strikes back: the power of data in the face of ""alternative facts""",0
can tai chi and computer games treat your adhd?,0
the shame game,0
tampons and death threats: tackling transphobia and the period taboo,0
pope francis concerned about infection from holy spirit bite,1
a republican congressman just destroyed trump's 'lie' of a budget,0
"huntsman drops out, endorses huntsman",1
biden puts on lucky debate suit,1
yeti releases abdominable crunch workout video,1
pentagon to withhold budget figures out of respect for american families,1
boehner vows to leave successor with clean slate,0
largemouth bass has largemouth sass!,1
glandular problem forces man to eat fifth helping,1
latest austin powers movie opens in theaters,1
14 things 'parks & recreation' taught us about food,0
aerobics show used for almost completely non-aerobic purpose,1
"alex morgan talks world cup, wedding planning, and yoga on the road",0
cackling trump reveals to dinner guests they've all just eaten single piece of his tax returns,1
5 life lessons i learned from holding a garage sale,0
viewing ads on website sole way in which man contributing to economy,1
'missed connection' ad obviously cheney,1
'i didn't just scream',0
man runs out of questions to ask 4-year-old,1
"trumpcare is coming to iowa, and your state may be next",0
ex-iranian president mahmoud ahmadinejad plans to run again,0
chelsea handler has a last-minute reminder why you shouldn't vote for trump,0
aspen ideas festival 2015,0
god weirded out by christian who loves him after only month in church,1
every one of man's priorities unrecognizable to grandfather,1
trump raises concern over members of urban communities voting more than zero times,1
dead daughter would have wanted $220 million liability settlement,1
killer mike: 'uterus' comment was taken out of context,0
dan savage takes on ann coulter over transgender bathroom rights,0
jason derulo accuses american airlines of 'racial discrimination' after luggage dispute,0
remembering jim brady,0
"britain to send 125 military advisers to iraq, says david cameron",0
'springsteen on broadway' is the 'rock and roll storybook' dreams are made of,0
man opens fire on chicago subway train: police,0
assisted care facility hits grand fucking slam with little styrofoam cups of sherbet,1
underwear worn out of respect for the dead,1
whole foods announces it balancing out lower prices on most items by jacking cost of pita chips way up,1
"papa john's comes under fire for cruel treatment of the bulbous, deformed creatures that lactate pizza sauce",1
new iphone application tracks progress of deceased loved ones' decomposition,1
"in alaska, obama highlights climate change while his decisions draw accusations of 'hypocrisy'",0
rand's filibuster two-fer,0
paul giamatti lauded for supporting role in area murder,1
khloe kardashian rocks out with mason disick,0
terrifying man selling dead trees out of middle school parking lot,1
"gunman kills one, wounds four in shooting at german nightclub",0
this startup wants to make overpaying for a tiny nyc bedroom seem cool,0
walmart customer fatally shoots teen accused of stealing diapers,0
gm covered with giant tarp until it has money to work on cars again,1
townsfolk strongly prefer man's werewolf incarnation,1
clinton already working on follow-up book casting blame for failures of first,1
single 34-year-old man hasn't said full sentence aloud outside work hours in past 3 months,1
"despite trump, federal 'tort reform' makes a hasty retreat",0
god refuses to grant any more transcendent near-death experiences to people who crash snowmobiles,1
nation wishes it could just once be reminded of preciousness of life without mass shooting,1
louisa meets bear by lisa gornick,0
"gop race heads to south carolina, known for dirty tricks and brawls",0
charlottesville shows that states must amend their open-carry laws,0
kendrick lamar won a pulitzer because 'damn.' is journalism,0
what this ceo did proves that introverts make great leaders,0
"while trump attacks colin kaepernick, the quarterback is donating to meals on wheels",0
man in elevator in on conversation now,1
details hazy on 'death threats' against epa's scott pruitt,0
area horse hung like horse,1
office cheering on employee going for 32-minute nonstop work streak,1
amazing couple adopts 7 siblings to keep them together,0
trans in trumpland: election victories signal hope,0
nation not sure how many ex-trump staffers it can safely reabsorb,1
report:     % of americans suffer from synesthesia,1
area dad will only watch things in hd,1
baby dies after dad seen allegedly beating him while driving,0
public pension funds profit trump; possible links to shady russian business deals,0
firebrand john mccain demands immediate investigation into why he remaining complicit,1
what's it like being blind and gay? (video),0
"sxsw as cool and as real as it gets, reports marketing associate",1
why congress matters: lessons from ray rice and the vawa anniversary,0
area dad suffers massive nothing to worry about,1
could hillary clinton have what it takes to defeat the democrats in 2008?,1
new $50 million planetarium opens young minds to wonders of pink floyd,1
"area organization pro-white, ain't anti-nobody",1
disciplinarian parent annoying restaurant much more than unruly toddler ever could,1
travel ban is a minor win for trump and a major loss for human rights,0
consumer reports rates self 'excellent',1
9 things you're doing that drive your doctor crazy,0
watch bryan cranston's 'malcolm in the middle' character morph into walter white,0
katie couric flirts with cardinal on air,1
area man has some pretty shitty mob ties,1
west virginia flooding kills 24 and submerges towns,0
china unable to recruit hackers fast enough to keep up with vulnerabilities in u.s. security systems,1
diamonds are a girl's best friend -- and other feminist truths,0
stephen colbert let deray mckesson interview him about his whiteness,0
'please don't feed the poor' campaign catching on,1
remembering james horner,0
panama papers include dozens of americans tied to fraud and financial misconduct,0
friend's wife reportedly very funny,1
local woman considers telling gynecologist whole truth,1
misbuttoned coat makes perfectly sane woman look like raving lunatic,1
5 tricks to make your identity portfolio more secure,0
donald trump compares trade deal to rape,0
no one in group admits girls' night out a colossal failure,1
bush puts national guard in charge of public relations,1
progressive parents refuse to tell child its sex,1
7 things every homeowner should do before going on vacation,0
refugee blues,0
how jimmy carter learned to make his wife rosalynn a 'full' partner,0
anderson cooper shreds 'incoherent' trump: 'like a crazy person on a park bench',0
subway drops jared fogle as spokesperson,1
infertile aunt doing it up big at kids table,1
horrified pope calls philadelphia humanity's greatest sin against god,1
freedom with a twist of maturity,0
smithsonian institution politely declines sofa from charles in charge,1
obama's foreign policy approval drops in new poll,0
watch: why juliette lewis' parents helped her get emancipated,0
scalia's utter moral failure exposed,0
failed attempt at hyperbole yields dead-on statistic,1
kellyanne conway denies mike pence's expensive nfl exit was a 'political stunt',0
30 reasons to give thanks to horses,0
white house quietly retracts entire state of the union address,1
"yes, ashanti is still here and ready for you to 'say less'",0
celebrity disappointed after meeting fan,1
here's how a landmark ruling on trans teens' rights could have a colossal impact on schools,0
"in mental health awareness week, we need more than mental health 'first aid'",0
wal-mart greeter at death's door,1
heroic broken sewage pipe floods congress with human waste,1
police find adorable little skeleton,1
older trump voters say they oppose key elements of gop obamacare replacement,0
museum of television and radio acquires rare 'caroline in the city' episode,1
federal reserve vice-chairman roger ferguson: hot or not?,1
nation's sleep experts recommend cutting down on strobe light before bedtime,1
black americans support colin kaepernick. white people? not so much,0
man driving while making youtube video to explain how pc culture destroying america,1
ghost can't make a simple cup of coffee without everyone freaking out,1
"if you think your kid has trouble sleeping, this might be why",0
new pepsi product specifically mentions target demographic in name,1
the vietnam war is not history for victims of agent orange,0
chiropractor scrambling to put vertebrae back in right order before end of session,1
california's brutal drought could change the state forever,0
fox news problem solvers in way over their heads,1
georgia congressional candidate receives threatening package,0
family hesitant about sinking another 40 grand into repairs of dilapidated old grandma,1
bill gates finally getting into radiohead's kid a,1
smuggler allegedly brings weed-stuffed bible into jail,0
new movie taps into nation's love of rapping kangaroos,1
nuclear energy advocates insist u.s. reactors completely safe unless something bad happens,1
food network production assistants prep guy fieri with dry rub,1
"executive, legislative, judicial branches merge",1
study finds high school students retain only one-third of obsolete curriculum over summer,1
epa urges flint residents to stop dumping tap water down drain,1
man's area code provides exciting glimpse at past life,1
man with 3 kids going to make great father someday,1
nasa acquires moon for kennedy space center exhibit,1
nation doesn't know if it can take another bullshit speech about healing,1
nation's lower class still waiting for first mention by either presidential candidate,1
"texas officials really, really want you to know sandra bland had marijuana in her system",0
"seriously, where do all the baby socks go?",0
unlocking big data's value potential through design with small data,0
plan to make snacks last through opening credits fails,1
beekeeper wishes he understood women like he understands bees,1
dismembered nate silver found in dumpster behind gallup headquarters,1
man pushing self to point of effort,1
senator manchin's latest attempt at curbing opioid addiction is a very bad idea,0
local bull dreams of traveling to spain for running of the bulls,1
"previewing 'hidden figures' with the teary-eyed octavia spencer, taraji p. henson and janelle monáe",0
nation's grandfathers to receive annual shipment of $2 bills from u.s. treasury,1
michael jackson's reputation for punctuality in ruins,1
obama suddenly panicked after gazing too far into future,1
patriotic betrayal in the 1960s -- when the cia turned students into spies,0
apartment set up to create illusion of well-rounded life,1
wearable technology: the coming revolution in healthcare,0
long-shot push to force senate to confirm merrick garland fails in federal court,0
deadlocked supreme court: 'someone's voting twice',1
98% of babies manic-depressive,1
larva celebrates ascent to adulthood with bar-moltzvah,1
champagne company develops new second-place beverage,1
area man lives vicariously through son's bully,1
guys' night out to include several key non-guys,1
hostage negotiation talks stall in congress,1
"welcome to herointown, new jersey's 4th-largest city",0
abu ghraib inside joke lost on rest of world,1
"priest religious, but not really spiritual",1
late-arriving guest encouraged to load up on food sitting in sun for past 4 hours,1
equifax impressed by hackers' ability to ruin people's finances more efficiently than company can,1
"one court, indivisible, votes liberty and justice for all",0
report: cost of raising neglected children still low as ever,1
"syria ceasefire, backed by russia and turkey, holds after initial clashes",0
report: fax machines still pretty impressive if you think about it,1
nbc to add dateline: flursday,1
charter school advocates play the race card,0
"script could use another pass, mom says",1
bill clinton says 'we are all mixed-race',0
raffle ticket stared at with increasing disgust,1
paul manafort spends afternoon making house look presentable for next fbi raid,1
fruit of islam cause man to soil fruit of looms,1
bryan singer asks judge to dismiss sex abuse lawsuit,0
conservative media throw virginia gop candidate under the bus after election loss,0
"climate change: 2014 hottest yet, oceans threatened, solar trees, and more!",0
what to do when someone gives you a gift and you didn't get them one,0
here are the latest photos from march for our lives,0
why changing the world is a two-step process,0
director for aspca commercial demands sadder looking dogs,1
hillary clinton assured drop in polls just indication people haven't abandoned ideals yet,1
"dui crash suspect: arrest my dog, not me",0
husband chooses car based on lowest passenger-side impact rating,1
daily meditation: joyful,0
historical archives: one may now toil from home,1
debunking the myths about boys and emotions,0
woman 7 golden retrievers short of childhood vision,1
patrick stewart reads hilariously bad reviews of iconic tourist attractions,0
gop consultant pleads guilty in first super pac coordination conviction,0
clinton ominously tells iowan supporters to mark front doors with campaign logo before sundown,1
area man feels even lazier when he thinks about how much isis has accomplished this year,1
fighting gets worse in yemen despite saudi pledge to halt campaign,0
artist performs a kaleidoscopic transformation on fruits and veggies,0
area man's opinion hasn't been taken seriously by anyone in over a decade,1
prime minister of  norway gets laid,1
oil prices soar like noble eagle,1
please stop asking this unsettling question to women everywhere,0
obama increases sense of urgency by riding last white rhino on earth through climate talk,1
every intern at nonprofit trying to solve refugee crisis first,1
rookie trucker always on cb to mother,1
why we can't ignore the outliers,0
the biggest fails of the month,0
"we're getting closer to leaving home without phones, and this thing is the key",0
"ex-boyfriend hopes to still be terrible, incompatible friends",1
baha'i prayer and quotes about america,0
michelle wolf speaks out on white house correspondents' dinner controversy,0
"uma thurman, ethan hawke to sire new race of homo celbritans",1
going back to congo,0
hillary clinton sends pizza to fans camping out overnight for her book signing,0
boy spends his allowance on hundreds of books for inmates,0
academy calls possible effect of trump's ban on foreign nominees 'extremely troubling',0
this woman gave cellulite a perfect nickname,0
"christie describes isis as grave, towering, meaty threat to u.s. while staring at diner patron's corned beef sandwich",1
supporters defend kirsten gillibrand after trump delivers 'sexist smear',0
'watermelon capital of world' claim goes unchallenged,1
watch: need to feel bad?,0
