text,label
this video of a road being surfaced is ridiculously satisfying,0
man searching for part of chicken tender thin enough to fit into plastic dipping sauce cup,1
"fox news host disavows internment camps, after panelists suggest rounding up muslims",0
shadow government getting too large to meet in marriott conference room b,1
honoring those who make a difference for animals,0
no one else but you invited to creepy dave's debate party,1
14 snapshots that summed up parenthood in 2014,0
how we've kept our son from feeling like he's from a 'broken home',0
sixth grader begins work on pony trilogy,1
fish species not seen since 1960s thinks it can waltz back into marine biologist's life just like that,1
13 badass grandparents who are having more fun than you,0
"with all eyes on trump, texas may soon pass horrific anti-lgbtq laws",0
"mexico's no. 1 baja beach resort: the villa del palmar, south of loreto",0
"bill henderson, jazz vocalist and actor, dies at 90",0
quick-lube shop masters electronic record keeping six years before medical industry,1
fcc chief cites special occasion for allowing vaginal penetration on network sitcom,1
'black panther' success will help fund boys & girls clubs' stem centers,0
man always insists you toss him keys rather than just hand them to him,1
"to cure cancer, biden says have to overcome 'cancer politics'",0
obama takes part in town hall on gun violence,0
defunct 4-year-old sports blog still lurking on internet,1
woman devises latest delusional scheme for burning extra calories during workday,1
gap forced to recall pants after man dies eating 37 pairs of corduroys,1
national filmstrip board calls for quiet,1
frederick's of anchorage debuts crotchless long underwear,1
sheets changed after every breakup,1
pope admits he made 'serious errors' in handling chile sex abuse allegations,0
see 2 billion 'star wars' deaths in three minutes,0
big checks power jeb bush super pac's unreal money haul,0
new clinton memoir: 'we all made mistakes but you made most of them',1
celine dion performs emotional tribute at the billboard music awards,0
bush arrives at debate wearing flight suit,1
17 sweet water toys and swim essentials,0
youngest sibling in family kind of thought mom would lose steam by now,1
internet jokester strikes again,1
the gop theme o' the week,0
who says all countries should tax sugary drinks to curb obesity,0
peyton manning calls doping allegations 'complete trash',0
alligator can't stop thinking about delicious swan from last week,1
the easiest & cheapest way to update your beauty look,0
nation demands more slow-motion footage of syrup cascading onto pancakes,1
nation finishes romantically pairing off except for the losers,1
area woman insists on helping coworker through personal crisis,1
no one murdered because of this image,1
best visual effects oscar introduced by highly acclaimed lens flare,1
nation's stomach ulcers predict trump administration will provide opportunities for unlimited growth in 2017,1
unfinished basement has weird feeling about way woman looking at it,1
u.s. soothes upset netanyahu with shipment of ballistic missiles,1
austin rogers explains the real secrets to his 'jeopardy!' success,0
three questions about the aereo supreme court case that desperately need answers,0
19 adorable doggie save-the-dates for when you're having a ruff day,0
educator cuts deal in teacher cheating scandal,0
trevor noah mocks republican conspiracy theories on russian probe,0
why sharing your dreams is so important,0
5-year-old says 'sesame street' has sucked since 2010,1
"from an adopted daughter, what my moms taught me about parenting",0
irs can't believe area man didn't get a raise last year,1
hilton head island is the best,0
"work life, personal life both spent desperately trying to appeal to women 18 to 34",1
greenland thinks it looks fat in mercator projection,1
how the russians won world war iii - a short history,0
teen learns the negligible value of a dollar,1
aid workers face an underreported sexual violence crisis,0
the 14 new style stars who will light up the red carpet in 2016,0
national dialogue dusted off,1
"humor, hope, and human rights: on the loss of robin williams",0
bush: 'history cannot judge me if i end it soon',1
man accused of molesting 5 kids,0
woman with really pointy feet finds perfect shoes,1
broadway stars 'give a little bit' to say thanks this holiday season,0
a new 9/11 gift shop,0
justice kennedy out for rest of session with tear in adjudicatory tendon,1
achieving presentation zen,0
halloween decorations blending in nicely with christmas lights,1
george clooney slams donald trump for 'idiotic' comments about mexico,0
new census study finds that 40% of u.s. population is filler,1
mike pompeo can't believe senate just expects he'll answer questions without being tortured first,1
presidential debate ignores climate change ... again,0
new details paint unsettling pictures of london attackers,0
lionel richie explains why he decided to adopt his daughter nicole,0
graduation party more lucrative than planned future career,1
"nation dutifully gets in cars, stands in line, watches new star wars movie",1
"'just illegalize us already,' nation's assault weapons beg",1
nbc obtains video claiming to show anti-isis raid that killed u.s. operative,0
understanding your finances after your child is accepted to college,0
kermit the frog covering shaggy's 2000s classic 'it wasn't me' is comedy gold,0
dancing with thieves,0
relationship at point where woman has to learn boyfriend's family's weird card games,1
wedding guest blissfully unaware she barely made the cut,1
10 ways you and your child can survive end-of-school madness,0
what comes next? rockwell reminds us,0
aquarium touch tank lets kids pet water in natural environment,1
woman barely jogging,1
paleontologists: 'we've been looking at dinosaurs upside down',1
ceo spends 30 percent of earnings staying out of jail,1
study finds american diets are poor (but improving!),0
"company to use internet to waste money, employees' time",1
campus tour guides reminded to use official name for rape hall,1
kerry volunteer gets some kerry-primary victory sex,1
10 things i learned as a new adjunct teacher,0
everything that's wrong with business in america given promotion,1
high-school teacher reluctantly breaks up fight,1
this election year's darwin award goes to the folks behind this political mailer,0
former president carter sole attendee at 1997 solar power summit,1
rap star rick ross put on life support: report,0
new social media start-up aims to be cross between facebook and facebook,1
the supreme court has had enough of the lethal injection debate,0
"aol/time warner turmoil over-reported, says time",1
national essay writing contest now accepting video submissions,1
injured troops request extended tours to avoid being sent to walter reed,1
bush campaign paints kerry as pre-raphaelite contessa,1
escaping the higher education stockholm syndrome,0
clear from stock music that video never meant to be watched with sound on,1
governor approves 24-hour waiting period for women voters,1
"jennifer lopez billboard music awards 2015 gown is super see-through, obvi",0
report: north korea just enjoys nuclear talks,1
'parent trap' producers recall euthanizing lindsay lohan clone after completing filming,1
woman decides period over,1
scientists develop new extra-sloppy peach,1
"my worst audition ever?  or, the danger of playing paddle ball, chewing gum, and singing ""we built this city"" simultaneously",0
illinois considers allowing recall attempts of chicago mayor,0
"sadly, gift certificate to loews cinemas perfect gift for area man",1
is ukraine fascist?,0
a painter searches for a more interconnected vision of humanity,0
college roommates to continue bonding process until real friends made,1
woman nervous mom starting to use her as confidant,1
nancy pelosi rushes into living room to hear grandson's first talking point,1
area man disappointed in self for already being full,1
routine drunk-driving trip turns tragic for five local teens,1
the simple trick that'll make your old sweaters look new again,0
blood drains from mueller's face after realizing russia investigation might go all the way to white house,1
sean hannity gets brutally rejected by attorney for moore accuser,0
aol instant messenger to sign off forever after 20 years,0
"'no, no, dear god no,' mumbles powerball presenter after drawing pitch-black ball",1
"nunes: 'the american people have a right to know the contextless, selectively-edited truth'",1
greg hardy unapologetically denies domestic abuse allegations,0
libyans agree to come up with something for qaddafi to do all day in exchange for him leaving,1
man just going to assume apartment has functional carbon monoxide detector somewhere,1
incredible new slate of documentaries to elevate everyday lgbt heroes,0
toy prepares child to one day pull around real telephone on wheels,1
crazed loiterer strikes again,1
marco rubio makes huge push to gain millennial voters,0
sun goes out for a few seconds,1
tight wisconsin house primary too close to call (update),0
"with greetings from trump, pence says u.s. committed to europe",0
arianna huffington has webcam implanted in forehead,1
twitter now revoking verified profiles that break its new rules,0
the power of keeping it personal,0
feds find criminal wrongdoing in g.m.'s failure to disclose defect,0
"progress on global poverty and disease at risk, gates says",0
what to expect when you're expecting a couch,0
"fda okays every drug pending approval, takes rest of year off",1
man deftly downplays his neighborhood to coworker thinking of moving there,1
"busy mel kiper, jr. still finds time to throw around the old spreadsheet with his daughter",1
montana has the highest death rate for white americans -- and it's rising,0
twitterverse trolls marco rubio over his 'fool' bible verse tweet,0
guy in bear costume has no problem voting in russian election,0
"report: oh, fuck yeah, egg yolk dripping all over sandwich",1
jennifer lopez comes out with own clothesline line,1
coworker almost got that exact same thing when he ate there,1
no velvet rope for healthcare abroad,0
are you catching other people's emotions?,0
rush limbaugh tucks shirt back in following animated flat tax rant,1
dick masturbates in tickle creek: cops,0
all men are created equal. does president trump agree?,0
greyhound doesn't know if its own bus drivers are too tired,0
"world health organization: 'not sure how, but adam levine's new fragrance the only antidote to mers virus'",1
"oil train derails, spilling crude in columbia river gorge",0
there can be dignity in the face of poverty,0
"worthless dog can't talk, drive, solve crimes",1
8 healthy snacks to keep hunger at bay,0
trump campaign training poll watchers to spot any suspicious skin colors on election day,1
north korea test-fires ballistic missile in defiance of world pressure,0
ranking 25 of the best 'american horror story' characters ever,0
moviegoer manages to sneak candy past teenage usher earning $7 an hour,1
area man totally blows his chance to see 'exodus: gods and kings' in theaters,1
everest avalanche victim's loved ones launch campaign dedicated to 'living life as an adventure',0
"in his new act, tommy tune vows to be a 'vitamin for the spirit'",0
three-year-old gets carried away,1
man has story for every stain on pants,1
dejected dog too sad to walk after being returned to shelter,0
"a crow didn't touch me, i got my period",0
cops recording your every move for 10 weeks doesn't violate the constitution,0
white house responds to sexual misconduct allegations against roy moore,0
transmasculine bodies and the media,0
majority of time at party spent trying to figure out ride home,1
"hillary clinton spends busy day fueling speculation, not ruling things out",1
epa didn't know anybody was still drinking water,1
unclear whether grandpa having good time,1
whoops! selfie snapper smashes sculpture days after exhibit opens,0
republicans poised to retain control of senate,1
woman quickly reading up on candidates' policy stances after voting,1
authorities say country still an active shooter situation,1
look: surfer almost runs over shark with stand-up paddleboard and has no idea,0
"local man knows he moved to minneapolis for something, but can't remember what",1
astronomers predict giant asteroid will hit nation's theaters this summer,1
lazy wildlife rescuer lets oily pelicans pile up in sink for 5 days,1
"huffpost hill - trump bribes company to send jobs to mexico, scores huge win",0
right side of fish tank where all the action at,1
'wheel of fortune' contestants hit hard as vowel prices skyrocket,1
khizr khan sees a shared 'moral compass' in lessons of japanese-american incarceration,0
"depression, strained finances combine forces to produce grotesque culinary abomination",1
report: 93% of drunk drivers get home just fine,1
conceptual genius goes as self for halloween,1
"snoop dogg to perform at dnc, courtesy of big pharma",0
mom fires back at shamers who criticized her baby's food photo shoot,0
strangely compelling 'shybot' roams california desert avoiding humans,0
abandoned mall retains eerie vestiges of fun shopping atmosphere,1
urban polling centers recommend voters start lining up now for 2016 election,1
daily meditation: spark creativity,0
cnn producer on hunt for saddest-looking fuck with convention button collection,1
heroic pants enter 19th day of continuous duty,1
the mediterranean refugee crisis,0
man who drinks 5 diet cokes per day hoping doctors working on cure for whatever he's getting,1
"gay gene isolated, ostracized",1
man flirting with girl at party can't wait to be informed she has boyfriend,1
ups reports troubling drop in residents answering doors in lingerie,1
this is all the advice you need for surviving hardship,0
bruce davis eligible for parole for charles manson family murders,0
alabama quietly strikes bo bice day from state calendar,1
slovenian 8th-graders surprised even they outperformed u.s. students in science,1
new study finds you'd love being rich asshole,1
samantha bee rips nra-beholden senators with spoof halloween costumes,0
experts warn repeated attempts at eradicating obamacare may have created ultra-resistant super law,1
natural light very important to local man,1
stunned family watches as grandmother wolfs down sandwich in 33 minutes,1
patient zero kicking back in 38c with episode of 'new girl',1
"dwayne 'the rock' johnson saves puppy from drowning, melts our hearts in the process",0
how to make a cocktail while flying,0
wave of dread makes rare daytime appearance,1
kurt warner cheered on by wire-haired man-goblin,1
"iraqi troops retake the town of nimrud, near historic ruins, from isis",0
doctors in puerto rico face mounting medical crisis in maria's wake,0
apple names jeff williams new coo,0
how the 'bachelor in paradise' premiere handled the shutdown,0
my lovely wife in the psych ward,0
video game henchmen plan meetup around explosive barrels,1
"if your doctor won't give you an iud because you haven't had kids, you need a new doctor",0
man wishes women in crowded bar would let him read jane austen novel in peace,1
classically trained actor can talk on cue,1
secretary of agriculture gently reminded about dress code,1
night watchman keeps leno under close surveillance,1
iowa restaurant patron can remember every breakfast ruined by presidential candidates,1
guy just totally smoking weed on street,1
frozen tundra of emptiness stretching out forever and ever weighed against date with mike4763,1
14 photos show the utter bravery of serving while trans,0
"my grandmother taught me to love mississippi, but our state flag represents hate",0
renowned ornithologist always secretly wanted to be a bird,1
fifth harmony's lauren jauregui blasts 'toxic' homophobia in poignant twitter exchange,0
israel agrees to creation of palestinian homeroom,1
arizona republicans want to prosecute protesters the same way they do terrorists,0
donald trump flat out lies about his reaction to charlottesville,0
suicide bombing near afghan parliament kills more than 30,0
biden busted in dnc parking lot selling bootleg 'i'm with her' t-shirts,1
study finds 73% of marble statuettes of achilles used to beat to death wealthy dowager,1
poll finds declining number of americans believe they god,1
"box of old playboys found, good ones too",1
don sterling won't get an naacp award after all,0
next week's school shooting victims thank senate for failing to pass gun bill,1
showers with girlfriend increasingly cleansing-focused,1
real-life scene filled with product placement,1
5 easy breakfast bowls that are healthier than cereal,0
archivists discover unpublished michael crichton manuscript about amusement park that operates without a hitch,1
man too deep into sentence to avoid saying word he can't pronounce,1
"hillary clinton to release 2015 tax returns within days, criticizes donald trump",0
victoria's secret also andrew's secret,1
shaq was the only one who didn't hear about kobe's retirement poem,0
parenting: the ultimate juggling act,0
"report: detroit bankruptcy might transform city into some kind of hellish, depopulated wasteland",1
woman to be ordained despite excommunication threat,0
"l.a. fitness announces plan to close all locations for 30-minute, high-intensity diversity training",1
my lust for the little frenchie!,0
seaworld responds to california drought by draining animal tanks halfway,1
a letter to ashtanga,0
"as per tradition, election results officially certified with two barks of approval from electoral collie",1
death row inmate can't deny he curious to see how state pulls off lethal injection,1
'finding dory' shows no signs of slowing down at the box office,0
fbi counterterrorists launch media campaign downplaying symbolic value of golden gate bridge,1
report: employers know within first 5 minutes of job interview whether they will murder applicant,1
the odd couple in today's office:  millennials reverse mentor baby boomers,0
"man forced to reverse-engineer point in midst of meandering, absentminded rant",1
keep the change: the beads that bought manhattan,0
nation's weirdest teenager buys season one dvd of 'murphy brown',1
alarming report finds only 6% of earth's surface indoors,1
'fed up' zara workers battle for more hours,0
virginia shooting somehow proves what every single american has been saying all along,1
khloé kardashian finally reveals her pregnancy in emotional instagram,0
death with dignity advocates say most catholic voters support the right to die,0
mother's day -- more than once a year,0
kfc introduces new boneless ceo,1
"'planet earth ii' finale finally resolves will-they/won't-they storyline between snow leopard, golden eagle",1
man trying to get out of executioner duty,1
perfect girlfriend blames self for everything,1
"police chief says there just a few bad, deeply ingrained prejudices giving all cops a bad name",1
sensitive scientists report 5 in 5 women don't know how beautiful they are,1
how to reduce barriers to better lgbtq healthcare,0
god shuts down andromeda galaxy,1
"hey, all you 20-somethings: breathe",0
you can train your brain to make smarter money decisions. here's how,0
president barack obama backs expanding social security,0
report finds drug tunnels most intact transport infrastructure in u.s.,1
senator 'alarmed' by reports u.s. military families were harassed,0
cancerous tumor befriends small boy,1
the major concern with the phone call with taiwan,0
let's change the conversation from climate change to 'shared benefits',0
comedian saffron herndon is 10 and already killing audiences,0
casting zionism as 'white nationalism' is anti-semitism,0
man recalls simpler time when he only masturbated to still images on internet,1
roomba claims another pet gerbil,1
cancer lobbies for decreased cancer funding,1
scientists confirm first case of zika transmission from article to reader,1
this love story will make every scrabble nerd's heart flutter,0
dionne warwick remembers bobbi kristina brown,0
opposition protesters rally in venezuela against president maduro,0
boehner delays leadership elections with gop in turmoil,0
5 labor day escapes that are totally worth the money,0
what's leaving netflix in may 2016?,0
find lead paint violations in new york city neighborhoods,0
frustration with husband taken out on soap scum,1
herbie goes bananas,1
george w and ron paul,0
blindfolded clinton invites debate coaches to attack her with talking points from all sides,1
bill maher mocks those offended by president obama's 'latte salute',0
area cow doesn't suspect a thing,1
timeout or burnout,0
bernie sanders willing to work with trump (but there's a big if),0
full-time mom drunk on the job,1
man always gets little rush out of telling people john lennon beat wife,1
stevie nicks dancing alone on beach under full moon,1
why father's day is so difficult for me,0
economists warn new graduates may have to tough it out for 5 to 6 weeks before landing dream job,1
supposed 'game of thrones' buff hasn't even finished books yet,1
17 pieces of feminist jewelry that'll show you're a nasty woman,0
home.  where's that?,0
guy's entire job just asking people if they have time for a quick chat,1
'steven universe' creator rebecca sugar on lgbt stories for kids,0
bird of paradise just staring at david attenborough during courtship dance,1
the limits of corporate citizenship: why walgreen shouldn't be allowed to influence u.s. politics if it becomes swiss,0
california's marijuana legalization aims to repair damage from the war on drugs,0
pilot tells passengers he's about to try something,1
jetblue is offering $49 flights in a 2-day flash sale,0
"mayor hits on crazy idea of developing city's waterfront, green spaces",1
uncle strikes out hard with book gift,1
people in healthcare.gov stock photos now visibly panicking,1
five-year-old convinced dinosaur bones are buried in backyard,1
3 tips for a happy financial new year,0
john kasich admits he's against d.c. statehood because it would give democrats more votes,0
woman-owned businesses on the rise in afghanistan,0
new 'do not kill' registry to allow americans to opt out of being murdered,1
"bombs explode outside 2 churches in las cruces, new mexico",0
new netflix gas lets users inhale multiple seasons of tv shows,1
hot new website 'facebook' is lighting up the charts,0
"quick, painless death tops holiday wish list of local veal calf",1
nobody was more delighted by the mtv movie & tv awards opening than hugh jackman,0
new study finds being on cover of 'people' magazine best predictor of revealing all,1
"solidarity, prayers and support for torched st. louis churches",0
best of abu dhabi: aditya vikram sengupta's labour of love,0
man defends home state's license plate design,1
call from daycare can't be good,1
obama spends another night searching behind white house paintings for safes,1
forged federal document complicates a growing fight over national monument designation in utah,0
strange new culture forming on other end of office,1
the 'danish girl' creative team share their experiences with the story,0
"'no blue, no green' -- new sylvia earle film shows power of protecting our oceans",0
william katt programs own name into tivo,1
this couple's wedding photo captures two generations of long-lasting love,0
tall young girl told she should play basketball,1
area man thinks movie he saw should have been nominated,1
"per tradition, ex-presidents watch obamas christen white house bed",1
how to outsmart the populists – lessons from france,0
area man relieved to hear state of union still strong,1
financial planner advises shorter life span,1
'lost dog' poster really tooting dog's horn,1
kalamazoo shooting suspect switched cars amid rampage,0
8 ways fitness changed my life,0
trump announces paris climate deal rejection in front of 16 running faucets,1
four incredible new advances in health technology,0
last-minute advice for parents paying for college - part i,0
toilet that uses 50 percent less water must be flushed six times,1
black athletes don't work on a plantation,0
deflategate: another image blow to the nfl that is not likely to hurt its business,0
25-year-old mayor wanted for running her town with whatsapp,0
"the oldest of the old are actually fine with dying, study finds",0
protecting our children when contending with threats of violence,0
college junior shares his strategy for getting the most out of tinder,0
banjo-wielding matt damon makes last-minute bid for best original song,1
"welcome to myanmar's (empty) capital city, president obama!",0
report: election day most americans' only time in 2016 being in same room with person supporting other candidate,1
report: election may come down to single candidate,1
cubs fans caught in time loop now that 'next year' is in the past,0
"meet eric dyer, the modern master of the zoetrope",0
winter storm threatens homeless man's plans to survive over thanksgiving,1
tractor pulls now number-one use for u.s. tractors,1
jack palance still dead at 87,1
company to experiment with valuing employees,1
icy snowball can already tell it going to make 9-year-old cry,1
about that woman vp candidate: klobuchar works better than warren,0
crank caller keeps jerking local news team around,1
snoop dogg rips trump in 'make america crip again',0
connecticut man visited by being from another time zone,1
turtle bocce balled around,1
"nation curious after discovering mysterious, eccentric benefactor paid off country's debt in full",1
donald trump says he'll cancel boeing's air force one contract,0
lieberman's overlords most displeased,1
the alabama redemption – perhaps not so surprising,0
london replica goes up in flames on great fire's 350th anniversary,0
trump: 'it's my honor to deliver the first-ever state of the union',1
just some guys in england driving a tank to the gas station,0
"meet one of the first cross-service, same-sex military couple to wed",0
