text,label
there's a major intensity gap on the gop's new health bill,0
obama again extends troop presence in afghanistan,0
this new orange era: the growing divide,0
huffpost's instagram: what's new,0
clinton goes on fun plane ride,1
tania bruguera: 'in cuba we have learned our duties very well but not our rights',0
how netflix's 'girlboss' perpetuates negative stereotypes,0
jennifer aniston engaged to guy who frankly will never replace brad,1
'it's just a nice place to live': meet the people of charleston,0
latest department of interior river count comes up one short,1
bruce dern shares hilarious memory of a girthy alfred hitchcock,0
fireflies almost salvage man's shitty day,1
mexican program aims to reach drug lords before they get caught up in cartels,1
nicole richie's beautiful figure ruined by pregnancy,1
andie macdowell: audiences' 'fear of getting older' hinders older actors,0
man does what he convinced himself he loves for a living,1
what's in a name?,0
tyra banks doesn't have time for drake's worst behavior in 'child's play' video,0
robert e. lee was not an 'honorable man.' he was a white supremacist traitor,0
what gop hopefuls think of tom cotton's iran bombing claim,0
area woman becomes republican vice presidential candidate,1
"now the texas governor wants blake farenthold to repay your $84,000",0
'spirit' of the iran nuclear deal is a two-way street,0
miley cyrus under fire in the uk for 'sexually suggestive' mac ad,0
kimmel brings down the house by giving trump's latest tweet a new ending,0
police escape charges in 96 percent of civil rights cases: report,0
dan coats lifts junior senator onto his shoulders to give better view of state of the union,1
the president of israel reaches out to palestinian arabs of israeli citizenship,0
coroner's report: john denver had sunshine on shoulders at time of crash,1
ceo has female sex organs,1
'bad moms' stars pull off amazing surprise for a single mom on 'ellen',0
key republican puts dagger in push to end filibusters,0
what mount greenwood's reaction to joshua beal's death says about white chicago,0
guy from sopranos drops by local pizza parlor for free slice,1
mccain silences critics with perfectly executed cartwheel,1
bolivia joins dopec,1
budget cheat day lets government splurge on anything it wants once a week,1
10 resolutions every woman should make in 2017,0
mitch mcconnell says americans won't tolerate democrats blocking supreme court nominations,0
madonna's anti-trump cover of britney spears' 'toxic' is the antidote we need to 2016,0
celebrity saddened by death of other celebrity,1
classmates awed by first-grader who gets free breakfast every day,1
study finds employees most productive when they can set their own salaries,1
trump supporter still sees obama taking his guns when he goes to sleep,0
broken hearts and eclairs,0
34-year-old woman anxiously realizes she doesn't have much time left to have career,1
6 things new hampshire's exit polls tell us about this election,0
review: new apple tv is bursting with potential,0
trump's afghan strategy is doomed for failure,0
meteorologists say upcoming hurricane season to be permanent,1
"trump backers share his animosity toward the media, poll shows",0
5 steps to an instant mental break,0
queen elizabeth ii to wed longtime partner following passage of gay marriage bill,1
the new world of cutthroat apps,0
al franken pledges to make up for sexist behavior over course of next four senate terms,1
pitbull's tasteless memorial day tweet brings americans together,0
12 delicious marcel duchamp quotes to unleash your inner artist,0
cash back incentives:  a winning strategy for health insurers and consumers,0
ford unveils new sport-futility vehicle,1
ashley judd fires up women's march with stirring 'nasty woman' performance,0
comic-book superrman impervious to copyediting,1
nervous pope candidate changes wine into jesus christ's urine,1
29-year-old has blast writing his will,1
teen crafting marketable persona in garage hoping to one day win grammy,1
cat so scared in shelter won't even look at you,0
"stock analysts confused, frightened by boar market",1
naturist retreat ends in boner,1
dan quayle on standby to take over as bush family patriarch after george h.w. admitted to icu,1
navratri 2014: a hindu celebration of the mother goddess,0
man would rather annoy small group of friends than bunch of strangers at party,1
keith olbermann asks if we should give 'president-elect p***y-grabber' a chance,0
maryland is beating most nations in olympic gold medals,0
walletless biden found handcuffed to bedpost,1
trump's labor law enforcer freezes worker-friendly reforms made under obama,0
starting college: a guide for parents in 2014,0
jeff sessions reportedly revives probe of uranium one deal,0
families of missing flight passengers just hoping media gets closure it needs,1
my friend michael and the power of acknowledgement,0
light playing beautifully off eric trump's gums at inaugural ball,1
governor demands to know which star on american flag is iowa's,1
more bad news for macy's ahead of holiday shopping season,0
seven-year-old told to take it like a man,1
vespa corporation enchants another slight little man-child,1
school teacher not about to risk her life for derek,1
george thorogood fan disgusted to learn musician licensed 'bad to the bone' for commercial purposes,1
north carolina republicans brace for 'bathroom law' blowback,0
report: texting while driving okay if you look up every couple seconds,1
intergalactic law enforcement officers place energy shackles on hillary clinton,1
"'he made the ultimate sacrifice,' trump tells military widow about scooby-doo putting up with scrappy-doo",1
exxon mobil told to hand over decades of climate documents in major legal blow,0
biden frantically cleaning up trashed vice president residence at last second,1
al roker slams 'moron' jim inhofe for bringing snowball to senate,0
taylor swift unveils even darker persona with new single 'skullfucking maggot shit boyfriend',1
different from the norm: 12 unique hotel stays in nyc,0
jon huntsman accepts post as ambassador to russia,0
"one of the biggest mistakes a manager can make, according to linkedin's ceo",0
"olympic skier stares down icy, forbidding slope of rest of life",1
man intensely public,1
latest news of israeli-palestinian violence makes man hungry for falafel,1
china disputes trump's claims of fentanyl 'flood' into united states,0
oregon militants' sympathizers emboldened by acquittal in wildlife refuge takeover,0
apple watch: success or failure?,0
friend's wife encountered twice a year,1
trump thinking of beginning rnc speech with sexist tirade he was saving for special occasion,1
report: store out of good kind,1
reuters journalists charged in myanmar after reporting on rohingya crisis,0
the fashion world is really trying to make crocs 'it' shoes,0
paddle into history in the first los angles river boat race,0
family impressed by extra effort father putting in to hide drinking,1
tom hardy goes from real-life hero to movie supervillain,0
no shelter: counting the homeless in seattle,0
astronomers discover most distant galaxy yet,0
taylor swift's mom says groping incident 'shattered our trust',0
white house: it's 'highly inappropriate' for journalists to criticize a general,0
police officers replace 11-year-old's stolen xbox with a brand-new one,0
eggs good for you this week,1
several women accuse progressive media executive don hazen of sexual harassment,0
annoying man more annoying after skydiving,1
"pulitzer prize winning play, and a winning director, too",0
rumsfeld sick of jokes about his fat girlfriend,1
fey rights group demands distinction from homosexuals,1
afghanistan bombings result in country's deadliest day for journalists,0
frolicking deer actually being driven mad by ticks,1
bleary-eyed coworker up all night generating more work for you,1
7 workout rules you can totally ignore,0
an astronaut's suggestion on how to fix politics would be expensive but probably pretty effective,0
viral tweet compares love to the feeling you get when you realize your dress has pockets,0
watch the conventions,0
"mount vernon says it owns george washington's copy of don quixote, not glenn beck",0
bakery owner vows to stop making wedding cakes altogether after pro-gay court ruling,0
john boehner's wife calls for her shutdown king to come back to bed,1
senate bill aims to lock hackers out of connected cars,0
a sikh american writes to donald trump,0
"rowdy, raunchy, jet-setting barbados can be more affordable than you might think",0
mexican presidential candidate calls for cutting off thieves' hands,0
chili's introduces savory new 200-times-baked potatoes,1
two folks wield lightsabers against fireworks from the dark side,0
man on vacation suddenly realizes no one feeding his hostages,1
new resort community still trying to think of name,1
clarissa from 'clarissa explains it all' is all grown up in new book,0
the fight to bring transparency to california's charter schools,0
see families reunite after donald trump's travel ban was lifted -- and try not to cry,0
six-year-old announces plans to become ballerina gymnast veterinarian horseback-riding princess,1
toddler scientists finally determine number of peas that fit into ear canal,1
restore your power through restorative sleep,0
pregnancy-related deaths nearly doubled in texas after cuts to women's health,0
masterchef recap: you're prawns are raw in 'top ten compete',0
entire house implicated by phish poster,1
the death of email,0
dad announces plan to honk when he's out front,1
"colorado church remembers fallen officer, asks forgiveness for shooter",0
4 reasons hallmark movies saved my holiday spirit,0
increasingly horrified man listens to self explain what he does for a living,1
myanmar is picking up the pieces after earthquake damaged ancient pagodas,0
don't be a product leader still failing in business,0
"nytimes.com's plan to charge people money for consuming goods, services called bold business move",1
fda recommends the blue marlin,1
why the rule of law is key to china's modernization,0
hank williams jr. honored by institute for football preparedness,1
'oitnb' star samira wiley's proposal story will hit you right in the feels,0
dad reaches age where it's no longer enjoyable to make fun of how old he is,1
two gay texans open up about building their dream family,0
antidepressant medication label reminds users that pill should never be mixed with long look in mirror,1
thursday's morning email: china fires diplomatic warning shots,0
badass surgeon puts on fingerless latex gloves before operating,1
area man finally sees enough images of bare breasts for entire lifetime,1
angry veterans use 'snl' to send president trump a serious message,0
selena gomez fuels zedd dating rumors with instagram photo,0
texas provider will offer free abortions for women affected by harvey,0
you will never love anything as much as dc's panda loves snow,0
lung cancer: saved by the scan,0
the mid-sex realization that changed everything,0
cash-strapped oklahoma to conduct executions by hammering squad,1
new tsa precheck program offers expedited interrogations for muslim passengers,1
read the full text of bernie sanders' 2016 democratic national convention speech,0
thing that was popular before brought back in hopes of it still being popular,1
production of 'iceman cometh' canceled due to entire cast getting called back for axe body spray commercial,1
joe biden backed bills to make it harder for americans to reduce their student debt,0
mike pence condemns female senators for wantonly sharing senate floor with male colleagues after dark,1
hawaii becomes the 7th state to legalize medically assisted suicide,0
molly hatchet posts surprise upset in former deep purple district,1
uncool zookeeper won't let anyone ride gorillas,1
man anxiously scanning bar's reaction to jukebox selection,1
7 ways to build a community using data-driven narratives,0
area man thinking about getting one of those all-body scans,1
"white-hot gop race down to two mentally ill people, person who lost nomination last time",1
woman assures you she's not mad,1
millions of shrimp airlifted from oil spill disaster zone,1
this mountain bike trail is nothing short of terrifying,0
gop 'self-deportation' fantasy is alive and well,0
no one at porn site responding to area man's bad link report,1
hillary clinton vs. herself,0
u.s. intel officials knew last year about cia security breach that led to wikileaks dump,0
owner admits fantasy team in rebuilding year,1
glimpse of gene shalit on tv reminds woman it's time for bikini wax,1
obama hosts diplomatic talks at starbucks while oval office carpet cleaned,1
pile of crap excites publicist,1
"news roundup for september 15, 2017",0
comedian shows how easy it is to get a medical marijuana card in california,0
"15,000 foreign fighters have joined extremist groups in iraq and syria. here's why they went",0
mentors we don't realize exist,0
"yamaha ceo pleased with current production of jet skis, alto saxophones, snowmobiles, power generators, scooters, golf carts",1
the 'perfect body' is a lie. i believed it for a long time and let it shrink my life,0
museum's audio guide informs visitors how much more they getting out of experience than others,1
"bear eats 20 pounds of dog food, promptly dozes off",0
woman who admits to having watched golden globes thinks jodie foster embarrassed herself,1
police repeatedly shoot tim cook after mistaking iphone for gun,1
ebola in sierra leone: 'it reminded me of a conflict zone',0
storybook romance leads to in-flight-magazine marriage,1
coworker even a dick in his expense reports,1
"despite growing support for marijuana, legalization faces rocky road",0
"explosion fells building outside paris, killing at least 2",0
the ugliest american: thinkers from around the world weigh in on trump's rise,0
new poll finds death of spouse most liberating experience in life,1
charlottesville goddam,0
catholic church rules perjury not a mortal sin,1
the quadruple bottom line: its time has come,0
morton unveils individually wrapped salt grains,1
mcdonnell-douglas unveils new 'gay-dar',1
how every new year's eve ends up being awful,0
narcissist mentally undresses self,1
smiling nation takes moment to enjoy thought of what rnc headquarters like right now,1
u.s. soldiers ask rumsfeld if they could get surprise visit from loved ones instead,1
focus group reveals: 95 percent of americans would like to go home,1
"struggling mom puts camper on sale to buy gifts, facebook responds with presents",0
cdc abruptly canceled a long-planned climate summit days before trump became president,0
innovative fat man combines waffles with ice cream,1
area man marks territory on bench with sweaty thigh outline,1
10 things to expect when you have cancer,0
cancer researchers develop highly promising new pink consumer item,1
"hypothetical cat simultaneously dead and alive, physicists say",1
"icymi: who faces more sexism, female politicians or lab rats?",0
bill hader is abso-moochly perfect as anthony scaramucci on 'snl: weekend update',0
the challenge of grief,0
taylor swift mourns death of boyfriend christopher dorner,1
"u.k. to investigate cambridge analytica, asks facebook auditors to stand down",0
restaurant patrons rapidly losing faith parents going to do something about 4-year-old,1
telling our medicine story,0
how to give a near perfect presentation (and why it's so hard for so many),0
media ignores cancer struggle of champion unicyclist,1
what these celebrities have to say about bullying may not be what you're expecting,0
how a group of outcast teen boys taught me the value of youth sports,0
'harry potter' actor alfred enoch says there's no reason hermione can't be black,0
cannibal corpse blasting from papal apartment window,1
nukes and the global schism,0
how lupita nyong'o got the role of trevor noah's mom in upcoming movie,0
god pissed after learning cost to replace earth's core,1
ariana grande issues 'donut fiasco' apology video that doesn't explain donut-licking,0
tracy morgan forgives the truck driver who almost killed him,0
public diplomacy in the pacific,0
ron paul withholding presidential endorsement until true libertarian candidate enters race,1
ho ho no -- 5 reasons there's no santa in our christmas,0
secretary of agriculture finally gets around to reading fast food nation,1
political crisis in iraq deepens,0
kfc paleontologists reconstruct 24-piece party bucket from single chicken leg,1
barbara boxer tells bob corker it's 'reckless' and 'irresponsible' to vote now on iran bill,0
"move over, katy perry. this nerdy professor has his own closing argument to make for clinton.",0
planned parenthood targets vulnerable gop senators with $2 million ad campaign,0
bradley cooper looks unrecognizable for new role,0
robert downey jr. volunteers to voice mark zuckerberg's real-life jarvis,0
controversial congressman touts iowa 'peasant hunt' with donald trump jr.,0
"nelson mandela admits thoughts, prayers of millions played no part in recovery",1
bodybuilder can't believe he forgot to develop right arm,1
massage therapist sues marvel comics' stan lee for alleged sexual misconduct,0
jesse jackson: 'absolutely' no reason for officer to shoot,0
4 ways retirees can be as 'smart' with their money as donald trump,0
"passengers 'lashing out' at scott pruitt justify first-class travel, new epa memo says",0
local couple celebrates birth of son with ritual genital mutilation,1
vin diesel breaks off tracking collar against rocky outcropping,1
tammys of the world demand to be taken seriously,1
north korea nukes self in desperate plea for attention,1
spacex reveals all 400 dogs on falcon rocket failed to survive trip,1
recent mlb incidents reveal warped ideas of manhood in sports,0
relapse greatest week of man's life,1
"new report finds it took humans 3,000 years after developing language to work up confidence to talk to each other",1
olive oil in skinny bottle obviously better,1
see miley cyrus freak out over a surprise phone call from hilary duff,0
bill maher calls out republican hypocrisy on 'real time',0
lady gaga kidnaps commissioner gordon,1
new study finds americans are living too long,1
film critic belatedly comes up with swordfish zinger,1
running in tap shoes: choreographer janine molinari on teaching broadway kids and other adventures in dance,0
the book we're talking about,0
gender equality won't just change women's lives -- it'll change everyone's,0
the peace process is dying at the hands of israel with help from hamas,0
new madonna album hailed as available for purchase,1
8-bit versions of famous art and pop icons are all kinds of yes,0
ali krieger's strategy for taking setbacks in stride,0
the biggest lgbt names in media hit new york for one-night-only fete,0
thursday's morning email: the republican tax plan's last-minute hurdles,0
two non-binary college activists on creating space for themselves on campus,0
10 ways ridiculously successful people think differently,0
the problem with paternalizing disabled people to protest donald trump,0
the pope and the politics of hope,0
"cop placed on leave after police crash pool party, pull gun on teens",0
john oliver rallies 'time-wasters and troublemakers' to fight the fcc,0
barry jenkins quietly makes history with oscar nomination trifecta,0
area teens find once-in-a-lifetime love,1
teen responsible for all six items in clarksburg police blotter,1
mit researchers discover each other,1
celebrities are freaking out as election results roll in,0
prince harry humiliates royal family yet again as base invaded by afghan insurgents,1
"bee stuck between screen door, front door going fucking nuts",1
iowan comforts sobbing jeb bush at town hall,1
struggling justice alito sent down to lower federal court,1
"democrats could lose up to 8,000 seats in upcoming midterm election",1
why we won't be participating in black friday,0
"viral photo captures incredible moment between police officer, homeless man",0
mom tucks handwritten guide on how to use netflix into kitchen drawer,1
school board adopts gay-ass uniform policy,1
trump says wasteful nea hasn't produced single valuable work since claes oldenburg's 'giant three-way plug',1
katherine heigl says she 'would never intend to be difficult',0
"supreme court leaves final decision on gay marriage in capable hands of texas, alabama, georgia",1
new report finds u.s. employees most engaged at workplace while working as frontman of styx,1
open dialogue two americans having about race pretty hilarious,1
obama camp vows to win neighborhoods where romney staffers are too afraid to go,1
"cameron diaz says she's 'actually retired,' so there",0
undertaker's last few embalmings before summer vacation always a little sloppy,1
"loose-lipped rudy giuliani does not represent u.s. on foreign policy, warns state department",0
california farmer water cutbacks blocked by judge,0
how isis uses wheat supplies to tighten its control in iraq,0
"youth homelessness is an invisible issue, but it doesn't have to be",0
ryan chugs down rhino horn and bull semen shake for mid-debate boost,1
both parties seem to be having a change of heart about federal power,0
cat with sunglasses is next-level chill,0
local burger feels especially disgusting today,1
model railroading a harsh mistress,1
taylor swift wins video of the year for 'bad blood' at 2015 vmas,0
"study: average american tries getting out of 10,000 things each year",1
adam levine's house in new york city is even hotter than he is,0
tuesday's morning email: shutdown fears grow amid daca fight,0
stepson absolutely nailing jeopardy category about third reich,1
aly raisman is not ok with banning gymnastics leotards to prevent abuse,0
donald trump channels the ghost of richard nixon,0
117-aerocar pileup clogs troposphere for hours,1
nation inspired by bravery of teen just wearing bikini right into mcdonald's,1
skywriter leaves suicide note,1
u.s. economy continues campaigning for barack obama,1
vehicles fall through wisconsin lake's ice as parking lot collapses,0
"russians to build, tear down statue",1
19 times shorter was way better,0
the campaign finance game,0
law schools now require applicants to honestly state whether they want to go to law school,1
hypothetical question clearly not hypothetical,1
cnn's hollywood minute announces special two-minute season premiere,1
new affordable daycare sort of keeps an eye on your kids,1
why my ex-husband gave his blessing at my second wedding,0
man realizes he shouldn't have told girl on phone he was taking dump,1
eric clapton wows audience with even slower version of 'layla',1
guy who got laid off just glad multi-national corporation will make it,1
fcc votes to undo key roadblocks to media company consolidation,0
fbi: six dead not really 'mass' murder,1
the american stories that cannot be untold,0
nurse being treated for ebola impressed with health workers' new gear,1
adjunct professor hoping some student leaves behind warm pair of gloves today,1
oakland artists take on gentrification as tech boom threatens their city,0
"encouragement of family, friends motivating man to keep struggling indefinitely",1
"a song for bruce rauner, illinois' uber-rich gop governor candidate",0
rumsfeld: 'my half-assed job here is done',1
pectoral muscles targeted by fitness fundamentalists,1
"kuwait may owe as much as $60,000 for trump hotel event in d.c.",0
even blue ivy joined james corden's 'carpool karaoke' at the grammys,0
decorative throw pillow positively aching for a quick plump,1
busy executive has to take this call girl,1
postmodern architect unveils 7-story found-art object,1
pornography-desensitized populace demands new orifice to look at,1
paula jarrel's gps guide for expressing self compassion,0
"area man coasting by on good looks, work ethic, in-depth knowledge of virginia real estate law",1
sharon tate's sister rips 'tacky' hilary duff film about manson family murder,0
senator baucus shows rest of congress where he found the dead body,1
michelin introduces tires for women,1
harry reid stunned by ted cruz's claim that most violent criminals are democrats,0
"it's national 'twilight zone' day, so here's every creepy laugh from the show",0
vin diesel puts on 35 pounds of bone for upcoming role,1
"'the shining' is now 'the chickening,' so be afraid and chicken",0
trump's whole approach to health care boiled down to one tweet,0
"convention-goer removes name tag, vanishes back into world of anonymous hilton orlando guests",1
steven spielberg recalls coming to blows with e.t. on film set,1
mass grave blasted for lack of diversity,1
ice agents hurl pregnant immigrant over mexican border to prevent birth on u.s. soil,1
north korea claims it's planning to fire missiles near guam,0
who's the old guy at lollapalooza?,0
"two dacamented dreamers, in alaska and texas, on fighting to stay home",0
texas to execute death row inmates with new 3-drug molotov cocktail,1
parasites just getting the hang of how host does things,1
few years in military would have really straightened out troubled teen killed on first tour of afghanistan,1
this 'bachelorette' fight about what engagement means is too real,0
taylor swift was 'the happiest maid of honor ever' at her best friend's wedding,0
trump says terror attack will 'probably help' marine le pen in french elections,0
think pynk,0
trail of lawn-mower assassin still fresh,1
"dad recounts amazing story of how, through quick thinking, he saved $4.27",1
phil spector joins jennifer hudson to present 'best new artist' grammy,1
hiring your first employee - what you don't know can hurt your business,0
it wasn't just white men who participated in the 'unite the right' rally,0
easy wife gives it up on first date night,1
cancer walk goes under 15-straight miles of high tensile power lines,1
office politician runs for coffee,1
will ferrell reprises his role as george w. bush for samantha bee,0
